[
  {"id":"nakshatra-1-1","nakshatra":1,"pada":1,"syllable":{"dev":"चु","lat":"Chu"},"names":[{"dev":"चुनमुन","lat":"Chunmun"},{"dev":"चुन्नी","lat":"Chunni"},{"dev":"चुन्नीलाल","lat":"Chunnilal"}],"review":"draft"},
  {"id":"nakshatra-1-2","nakshatra":1,"pada":2,"syllable":{"dev":"चे","lat":"Che"},"names":[{"dev":"चेतन","lat":"Chetan"},{"dev":"चेतना","lat":"Chetana"},{"dev":"चेतस","lat":"Chetas"},{"dev":"चेष्टा","lat":"Cheshta"},{"dev":"चेतक","lat":"Chetak"}],"review":"draft"},
  {"id":"nakshatra-1-3","nakshatra":1,"pada":3,"syllable":{"dev":"चो","lat":"Cho"},"names":[{"dev":"चोला","lat":"Chola"},{"dev":"चोलेश","lat":"Cholesh"},{"dev":"चोखेलाल","lat":"Chokhelal"}],"review":"draft"},
  {"id":"nakshatra-1-4","nakshatra":1,"pada":4,"syllable":{"dev":"ला","lat":"La"},"names":[{"dev":"लालिमा","lat":"Lalima"},{"dev":"लावण्या","lat":"Lavanya"},{"dev":"लाल","lat":"Lal"},{"dev":"लाजवंती","lat":"Lajwanti"},{"dev":"लालन","lat":"Lalan"}],"review":"draft"},
  {"id":"nakshatra-2-1","nakshatra":2,"pada":1,"syllable":{"dev":"ली","lat":"Li"},"names":[{"dev":"लीला","lat":"Leela"},{"dev":"लीलाधर","lat":"Leeladhar"},{"dev":"लीना","lat":"Leena"},{"dev":"लीलावती","lat":"Leelavati"}],"review":"draft"},
  {"id":"nakshatra-2-2","nakshatra":2,"pada":2,"syllable":{"dev":"लू","lat":"Lu"},"names":[{"dev":"लूणकरण","lat":"Loonkaran"},{"dev":"लूना","lat":"Loona"},{"dev":"लूमा","lat":"Looma"}],"note":"Names beginning with लू are uncommon; almanacs also accept the short लु.","review":"draft"},
  {"id":"nakshatra-2-3","nakshatra":2,"pada":3,"syllable":{"dev":"ले","lat":"Le"},"names":[{"dev":"लेखा","lat":"Lekha"},{"dev":"लेखन","lat":"Lekhan"},{"dev":"लेखराज","lat":"Lekhraj"},{"dev":"लेखनी","lat":"Lekhani"}],"review":"draft"},
  {"id":"nakshatra-2-4","nakshatra":2,"pada":4,"syllable":{"dev":"लो","lat":"Lo"},"names":[{"dev":"लोकेश","lat":"Lokesh"},{"dev":"लोचन","lat":"Lochan"},{"dev":"लोचना","lat":"Lochana"},{"dev":"लोहित","lat":"Lohit"},{"dev":"लोकनाथ","lat":"Loknath"}],"review":"draft"},
  {"id":"nakshatra-3-1","nakshatra":3,"pada":1,"syllable":{"dev":"अ","lat":"A"},"names":[{"dev":"अमन","lat":"Aman"},{"dev":"अनन्या","lat":"Ananya"},{"dev":"अर्जुन","lat":"Arjun"},{"dev":"अदिति","lat":"Aditi"},{"dev":"अभय","lat":"Abhay"}],"review":"draft"},
  {"id":"nakshatra-3-2","nakshatra":3,"pada":2,"syllable":{"dev":"ई","lat":"I"},"names":[{"dev":"ईशान","lat":"Ishaan"},{"dev":"ईशा","lat":"Isha"},{"dev":"ईश्वरी","lat":"Ishwari"},{"dev":"ईशिता","lat":"Ishita"}],"review":"draft"},
  {"id":"nakshatra-3-3","nakshatra":3,"pada":3,"syllable":{"dev":"उ","lat":"U"},"names":[{"dev":"उमा","lat":"Uma"},{"dev":"उदय","lat":"Uday"},{"dev":"उत्कर्ष","lat":"Utkarsh"},{"dev":"उर्वशी","lat":"Urvashi"},{"dev":"उज्ज्वल","lat":"Ujjwal"}],"review":"draft"},
  {"id":"nakshatra-3-4","nakshatra":3,"pada":4,"syllable":{"dev":"ए","lat":"E"},"names":[{"dev":"एकता","lat":"Ekta"},{"dev":"एकांश","lat":"Ekansh"},{"dev":"एकलव्य","lat":"Eklavya"},{"dev":"एषा","lat":"Esha"}],"review":"draft"},
  {"id":"nakshatra-4-1","nakshatra":4,"pada":1,"syllable":{"dev":"ओ","lat":"O"},"names":[{"dev":"ओम","lat":"Om"},{"dev":"ओजस","lat":"Ojas"},{"dev":"ओमकार","lat":"Omkar"},{"dev":"ओजस्वी","lat":"Ojaswi"}],"review":"draft"},
  {"id":"nakshatra-4-2","nakshatra":4,"pada":2,"syllable":{"dev":"वा","lat":"Va"},"names":[{"dev":"वाणी","lat":"Vani"},{"dev":"वासुदेव","lat":"Vasudev"},{"dev":"वामन","lat":"Vaman"},{"dev":"वासवी","lat":"Vasavi"},{"dev":"वात्सल्य","lat":"Vatsalya"}],"review":"draft"},
  {"id":"nakshatra-4-3","nakshatra":4,"pada":3,"syllable":{"dev":"वी","lat":"Vi"},"names":[{"dev":"वीर","lat":"Veer"},{"dev":"वीणा","lat":"Veena"},{"dev":"वीरेंद्र","lat":"Virendra"},{"dev":"वीथिका","lat":"Vithika"}],"review":"draft"},
  {"id":"nakshatra-4-4","nakshatra":4,"pada":4,"syllable":{"dev":"वु","lat":"Vu"},"names":[{"dev":"वृंदा","lat":"Vrunda"},{"dev":"वृषभ","lat":"Vrushabh"},{"dev":"वृषाली","lat":"Vrushali"}],"note":"No common name begins with वु; almanacs read the वृ (Vru) names here.","review":"draft"},
  {"id":"nakshatra-5-1","nakshatra":5,"pada":1,"syllable":{"dev":"वे","lat":"Ve"},"names":[{"dev":"वेद","lat":"Ved"},{"dev":"वेदा","lat":"Veda"},{"dev":"वेदांत","lat":"Vedant"},{"dev":"वेदिका","lat":"Vedika"},{"dev":"वेणु","lat":"Venu"}],"review":"draft"},
  {"id":"nakshatra-5-2","nakshatra":5,"pada":2,"syllable":{"dev":"वो","lat":"Vo"},"names":[{"dev":"वोहित","lat":"Vohit"},{"dev":"वोमिका","lat":"Vomika"},{"dev":"वोदिता","lat":"Vodita"}],"note":"Names beginning with वो are rare; almanacs also accept the nakshatra's other syllables.","review":"draft"},
  {"id":"nakshatra-5-3","nakshatra":5,"pada":3,"syllable":{"dev":"का","lat":"Ka"},"names":[{"dev":"कामिनी","lat":"Kamini"},{"dev":"कार्तिक","lat":"Kartik"},{"dev":"काव्या","lat":"Kavya"},{"dev":"कान्हा","lat":"Kanha"},{"dev":"कामना","lat":"Kamna"}],"review":"draft"},
  {"id":"nakshatra-5-4","nakshatra":5,"pada":4,"syllable":{"dev":"की","lat":"Ki"},"names":[{"dev":"कीर्ति","lat":"Kirti"},{"dev":"कीर्तन","lat":"Kirtan"},{"dev":"कीया","lat":"Kiya"},{"dev":"कीर्तिमान","lat":"Kirtiman"}],"review":"draft"},
  {"id":"nakshatra-6-1","nakshatra":6,"pada":1,"syllable":{"dev":"कु","lat":"Ku"},"names":[{"dev":"कुणाल","lat":"Kunal"},{"dev":"कुमुद","lat":"Kumud"},{"dev":"कुसुम","lat":"Kusum"},{"dev":"कुंदन","lat":"Kundan"},{"dev":"कुमार","lat":"Kumar"}],"review":"draft"},
  {"id":"nakshatra-6-2","nakshatra":6,"pada":2,"syllable":{"dev":"घ","lat":"Gha"},"names":[{"dev":"घनश्याम","lat":"Ghanshyam"},{"dev":"घनानंद","lat":"Ghananand"},{"dev":"घनवी","lat":"Ghanvi"}],"review":"draft"},
  {"id":"nakshatra-6-3","nakshatra":6,"pada":3,"syllable":{"dev":"ङ","lat":"Nga"},"names":[{"dev":"गगन","lat":"Gagan"},{"dev":"गंगा","lat":"Ganga"},{"dev":"गणेश","lat":"Ganesh"}],"note":"No name begins with ङ; following almanac practice the nearest sound ग is used here.","review":"draft"},
  {"id":"nakshatra-6-4","nakshatra":6,"pada":4,"syllable":{"dev":"छ","lat":"Chha"},"names":[{"dev":"छवि","lat":"Chhavi"},{"dev":"छाया","lat":"Chhaya"},{"dev":"छत्रपति","lat":"Chhatrapati"},{"dev":"छबीला","lat":"Chhabila"},{"dev":"छंदा","lat":"Chhanda"}],"review":"draft"},
  {"id":"nakshatra-7-1","nakshatra":7,"pada":1,"syllable":{"dev":"के","lat":"Ke"},"names":[{"dev":"केशव","lat":"Keshav"},{"dev":"केतकी","lat":"Ketaki"},{"dev":"केतन","lat":"Ketan"},{"dev":"केसर","lat":"Kesar"},{"dev":"केया","lat":"Keya"}],"review":"draft"},
  {"id":"nakshatra-7-2","nakshatra":7,"pada":2,"syllable":{"dev":"को","lat":"Ko"},"names":[{"dev":"कोमल","lat":"Komal"},{"dev":"कोकिला","lat":"Kokila"},{"dev":"कोविद","lat":"Kovid"},{"dev":"कोणार्क","lat":"Konark"}],"review":"draft"},
  {"id":"nakshatra-7-3","nakshatra":7,"pada":3,"syllable":{"dev":"हा","lat":"Ha"},"names":[{"dev":"हार्दिक","lat":"Hardik"},{"dev":"हारिका","lat":"Harika"},{"dev":"हास्या","lat":"Hasya"},{"dev":"हार्दिका","lat":"Hardika"}],"review":"draft"},
  {"id":"nakshatra-7-4","nakshatra":7,"pada":4,"syllable":{"dev":"ही","lat":"Hi"},"names":[{"dev":"हीरा","lat":"Heera"},{"dev":"हीरालाल","lat":"Heeralal"},{"dev":"हीना","lat":"Heena"},{"dev":"हीरल","lat":"Hiral"}],"review":"draft"},
  {"id":"nakshatra-8-1","nakshatra":8,"pada":1,"syllable":{"dev":"हु","lat":"Hu"},"names":[{"dev":"हुकुम","lat":"Hukum"},{"dev":"हुमा","lat":"Huma"},{"dev":"हुलास","lat":"Hulas"},{"dev":"हुनर","lat":"Hunar"}],"review":"draft"},
  {"id":"nakshatra-8-2","nakshatra":8,"pada":2,"syllable":{"dev":"हे","lat":"He"},"names":[{"dev":"हेमा","lat":"Hema"},{"dev":"हेमंत","lat":"Hemant"},{"dev":"हेमलता","lat":"Hemlata"},{"dev":"हेतल","lat":"Hetal"},{"dev":"हेमांगी","lat":"Hemangi"}],"review":"draft"},
  {"id":"nakshatra-8-3","nakshatra":8,"pada":3,"syllable":{"dev":"हो","lat":"Ho"},"names":[{"dev":"होरीलाल","lat":"Horilal"},{"dev":"होमेश","lat":"Homesh"},{"dev":"होमा","lat":"Homa"},{"dev":"होली","lat":"Holi"}],"review":"draft"},
  {"id":"nakshatra-8-4","nakshatra":8,"pada":4,"syllable":{"dev":"डा","lat":"Da"},"names":[{"dev":"डालिया","lat":"Dalia"},{"dev":"डालिम","lat":"Dalim"},{"dev":"डामर","lat":"Damar"}],"note":"Few names begin with the hard डा; almanacs commonly read the soft दा names here as well.","review":"draft"},
  {"id":"nakshatra-9-1","nakshatra":9,"pada":1,"syllable":{"dev":"डी","lat":"Di"},"names":[{"dev":"डीना","lat":"Deena"},{"dev":"डीलन","lat":"Dilan"},{"dev":"दीनेश","lat":"Dinesh"},{"dev":"दीनानाथ","lat":"Dinanath"}],"note":"Almanacs read the hard डी together with the soft दी.","review":"draft"},
  {"id":"nakshatra-9-2","nakshatra":9,"pada":2,"syllable":{"dev":"डू","lat":"Du"},"names":[{"dev":"डूंगर","lat":"Dungar"},{"dev":"डूंगरसिंह","lat":"Dungarsingh"},{"dev":"डूंगरमल","lat":"Dungarmal"}],"note":"Almanacs read the hard डू together with the soft दू.","review":"draft"},
  {"id":"nakshatra-9-3","nakshatra":9,"pada":3,"syllable":{"dev":"डे","lat":"De"},"names":[{"dev":"देव","lat":"Dev"},{"dev":"देविका","lat":"Devika"},{"dev":"देवेंद्र","lat":"Devendra"}],"note":"Almanacs read the hard डे together with the soft दे.","review":"draft"},
  {"id":"nakshatra-9-4","nakshatra":9,"pada":4,"syllable":{"dev":"डो","lat":"Do"},"names":[{"dev":"डोली","lat":"Doli"},{"dev":"डोरा","lat":"Dora"},{"dev":"डोंगर","lat":"Dongar"}],"note":"Almanacs read the hard डो together with the soft दो.","review":"draft"},
  {"id":"nakshatra-10-1","nakshatra":10,"pada":1,"syllable":{"dev":"मा","lat":"Ma"},"names":[{"dev":"माधव","lat":"Madhav"},{"dev":"माया","lat":"Maya"},{"dev":"मानव","lat":"Manav"},{"dev":"मानसी","lat":"Mansi"},{"dev":"माधवी","lat":"Madhavi"}],"review":"draft"},
  {"id":"nakshatra-10-2","nakshatra":10,"pada":2,"syllable":{"dev":"मी","lat":"Mi"},"names":[{"dev":"मीरा","lat":"Meera"},{"dev":"मीनाक्षी","lat":"Meenakshi"},{"dev":"मीत","lat":"Meet"},{"dev":"मीनल","lat":"Meenal"},{"dev":"मीहिका","lat":"Mihika"}],"review":"draft"},
  {"id":"nakshatra-10-3","nakshatra":10,"pada":3,"syllable":{"dev":"मू","lat":"Mu"},"names":[{"dev":"मूर्ति","lat":"Moorti"},{"dev":"मूलचंद","lat":"Moolchand"},{"dev":"मूलिका","lat":"Moolika"}],"review":"draft"},